schema_version,event_id,parent_event_id,task_id,event_time,step_name,actor_role,event_type,description,status,next_actor_role,next_expected_event,routing_decision_basis,commit_sha
v151,LEGACY-0001,,TASK-LEDGER-0001,2026-03-28T09:43:04+03:00,Exchange Ledger Bootstrap,OPERATOR,OPERATOR_OVERRIDE,Оператор явно распорядился создать governance/exchange_ledger.csv в репозитории как каноническое хранилище exchange-ledger до прохождения обычного pre-action audit loop. Файл создан исполнителем по прямой команде оператора.,OVERRIDE,,,LEGACY_BOOTSTRAP_NORMALIZATION,
v151,LEGACY-0002,,TASK-LEDGER-0002,2026-03-28T09:46:30+03:00,Exchange Ledger Bootstrap,EXECUTOR,TASK_PROPOSED,Первая каноническая запись о создании exchange-ledger. Исполнитель фиксирует факт создания governance/exchange_ledger.csv и передает результат на аудит. Ожидается решение аудитора по факту bootstrap exchange-ledger.,IN_REVIEW,,,LEGACY_BOOTSTRAP_NORMALIZATION,
v151,LEGACY-0003,,TASK-LEDGER-0003,2026-03-28T10:12:00+03:00,Exchange Ledger Bootstrap,AUDITOR,NOTE,audit note,IN_REVIEW,,,LEGACY_BOOTSTRAP_NORMALIZATION,
v151,LEDGER-NORM-0004,LEGACY-0003,TASK-LEDGER-NORM-0001,2026-03-29T11:00:00Z,LEDGER-NORM-1,EXECUTOR,TASK_REVISED,Normalized exchange ledger to canonical v151 schema with required fields preserved and bootstrap rows migrated.,IN_REVIEW,AUDITOR,RESULT_ACCEPTED,AUDITOR_PRE_ACTION_APPROVED_LEDGER_NORMALIZATION,
v151,LEDGER-NORM-0005,LEDGER-NORM-0004,TASK-LEDGER-NORM-0002,2026-03-29T11:10:00Z,LEDGER-NORM-2,EXECUTOR,TASK_REVISED,Normalized actor_role and next_actor_role values to canonical enum values in governance/exchange_ledger.csv.,IN_REVIEW,AUDITOR,RESULT_ACCEPTED,AUDITOR_POST_ACTION_APPROVED_WITH_CONDITIONS_LEDGER_NORM_1,
